{
  "$id": "https://calm-compass.local/schema/dashboard-snapshot.schema.json",
  "$schema": "https://json-schema.org/draft/2020-12/schema",
  "type": "object",
  "properties": {
    "version": {
      "type": "string",
      "const": "1"
    },
    "generatedAt": {
      "type": "string",
      "format": "date-time",
      "pattern": "^(?:(?:\\d\\d[2468][048]|\\d\\d[13579][26]|\\d\\d0[48]|[02468][048]00|[13579][26]00)-02-29|\\d{4}-(?:(?:0[13578]|1[02])-(?:0[1-9]|[12]\\d|3[01])|(?:0[469]|11)-(?:0[1-9]|[12]\\d|30)|(?:02)-(?:0[1-9]|1\\d|2[0-8])))T(?:(?:[01]\\d|2[0-3]):[0-5]\\d(?::[0-5]\\d(?:\\.\\d+)?)?(?:Z|([+-](?:[01]\\d|2[0-3]):[0-5]\\d)))$"
    },
    "fallbackMode": {
      "type": "string",
      "enum": [
        "ai",
        "deterministic"
      ]
    },
    "sourceFreshness": {
      "type": "array",
      "items": {
        "type": "object",
        "properties": {
          "source": {
            "type": "string",
            "minLength": 1
          },
          "checkedAt": {
            "type": "string",
            "format": "date-time",
            "pattern": "^(?:(?:\\d\\d[2468][048]|\\d\\d[13579][26]|\\d\\d0[48]|[02468][048]00|[13579][26]00)-02-29|\\d{4}-(?:(?:0[13578]|1[02])-(?:0[1-9]|[12]\\d|3[01])|(?:0[469]|11)-(?:0[1-9]|[12]\\d|30)|(?:02)-(?:0[1-9]|1\\d|2[0-8])))T(?:(?:[01]\\d|2[0-3]):[0-5]\\d(?::[0-5]\\d(?:\\.\\d+)?)?(?:Z|([+-](?:[01]\\d|2[0-3]):[0-5]\\d)))$"
          },
          "status": {
            "type": "string",
            "enum": [
              "fresh",
              "stale",
              "unavailable"
            ]
          },
          "reason": {
            "type": "string",
            "minLength": 1
          }
        },
        "required": [
          "source",
          "checkedAt",
          "status"
        ],
        "additionalProperties": false
      }
    },
    "focus": {
      "anyOf": [
        {
          "type": "object",
          "properties": {
            "id": {
              "type": "string",
              "minLength": 1
            },
            "title": {
              "type": "string",
              "minLength": 1
            },
            "due": {
              "type": "string",
              "format": "date",
              "pattern": "^(?:(?:\\d\\d[2468][048]|\\d\\d[13579][26]|\\d\\d0[48]|[02468][048]00|[13579][26]00)-02-29|\\d{4}-(?:(?:0[13578]|1[02])-(?:0[1-9]|[12]\\d|3[01])|(?:0[469]|11)-(?:0[1-9]|[12]\\d|30)|(?:02)-(?:0[1-9]|1\\d|2[0-8])))$"
            },
            "timingReason": {
              "anyOf": [
                {
                  "type": "string",
                  "minLength": 1
                },
                {
                  "type": "null"
                }
              ]
            },
            "effort": {
              "type": "string",
              "enum": [
                "quick",
                "medium",
                "deep"
              ]
            },
            "why": {
              "type": "string",
              "minLength": 1
            },
            "evidence": {
              "minItems": 1,
              "type": "array",
              "items": {
                "type": "object",
                "properties": {
                  "source": {
                    "type": "string",
                    "minLength": 1
                  },
                  "id": {
                    "type": "string",
                    "minLength": 1
                  },
                  "reason": {
                    "type": "string",
                    "minLength": 1
                  }
                },
                "required": [
                  "source",
                  "id",
                  "reason"
                ],
                "additionalProperties": false
              }
            }
          },
          "required": [
            "id",
            "title",
            "due",
            "timingReason",
            "effort",
            "why",
            "evidence"
          ],
          "additionalProperties": false
        },
        {
          "type": "object",
          "properties": {
            "id": {
              "type": "string",
              "minLength": 1
            },
            "title": {
              "type": "string",
              "minLength": 1
            },
            "due": {
              "type": "null"
            },
            "timingReason": {
              "anyOf": [
                {
                  "type": "string",
                  "minLength": 1
                },
                {
                  "type": "null"
                }
              ]
            },
            "effort": {
              "type": "string",
              "enum": [
                "quick",
                "medium",
                "deep"
              ]
            },
            "why": {
              "type": "string",
              "minLength": 1
            },
            "evidence": {
              "type": "array",
              "items": {
                "type": "object",
                "properties": {
                  "source": {
                    "type": "string",
                    "minLength": 1
                  },
                  "id": {
                    "type": "string",
                    "minLength": 1
                  },
                  "reason": {
                    "type": "string",
                    "minLength": 1
                  }
                },
                "required": [
                  "source",
                  "id",
                  "reason"
                ],
                "additionalProperties": false
              }
            }
          },
          "required": [
            "id",
            "title",
            "due",
            "timingReason",
            "effort",
            "why",
            "evidence"
          ],
          "additionalProperties": false
        }
      ]
    },
    "quickWin": {
      "anyOf": [
        {
          "type": "object",
          "properties": {
            "id": {
              "type": "string",
              "minLength": 1
            },
            "title": {
              "type": "string",
              "minLength": 1
            },
            "due": {
              "anyOf": [
                {
                  "type": "string",
                  "format": "date",
                  "pattern": "^(?:(?:\\d\\d[2468][048]|\\d\\d[13579][26]|\\d\\d0[48]|[02468][048]00|[13579][26]00)-02-29|\\d{4}-(?:(?:0[13578]|1[02])-(?:0[1-9]|[12]\\d|3[01])|(?:0[469]|11)-(?:0[1-9]|[12]\\d|30)|(?:02)-(?:0[1-9]|1\\d|2[0-8])))$"
                },
                {
                  "type": "null"
                }
              ]
            },
            "timingReason": {
              "anyOf": [
                {
                  "type": "string",
                  "minLength": 1
                },
                {
                  "type": "null"
                }
              ]
            },
            "effort": {
              "type": "string",
              "enum": [
                "quick",
                "medium",
                "deep"
              ]
            },
            "why": {
              "type": "string",
              "minLength": 1
            },
            "evidence": {
              "type": "array",
              "items": {
                "type": "object",
                "properties": {
                  "source": {
                    "type": "string",
                    "minLength": 1
                  },
                  "id": {
                    "type": "string",
                    "minLength": 1
                  },
                  "reason": {
                    "type": "string",
                    "minLength": 1
                  }
                },
                "required": [
                  "source",
                  "id",
                  "reason"
                ],
                "additionalProperties": false
              }
            }
          },
          "required": [
            "id",
            "title",
            "due",
            "timingReason",
            "effort",
            "why",
            "evidence"
          ],
          "additionalProperties": false
        },
        {
          "type": "null"
        }
      ]
    },
    "continueItem": {
      "anyOf": [
        {
          "type": "object",
          "properties": {
            "id": {
              "type": "string",
              "minLength": 1
            },
            "title": {
              "type": "string",
              "minLength": 1
            },
            "due": {
              "anyOf": [
                {
                  "type": "string",
                  "format": "date",
                  "pattern": "^(?:(?:\\d\\d[2468][048]|\\d\\d[13579][26]|\\d\\d0[48]|[02468][048]00|[13579][26]00)-02-29|\\d{4}-(?:(?:0[13578]|1[02])-(?:0[1-9]|[12]\\d|3[01])|(?:0[469]|11)-(?:0[1-9]|[12]\\d|30)|(?:02)-(?:0[1-9]|1\\d|2[0-8])))$"
                },
                {
                  "type": "null"
                }
              ]
            },
            "timingReason": {
              "anyOf": [
                {
                  "type": "string",
                  "minLength": 1
                },
                {
                  "type": "null"
                }
              ]
            },
            "effort": {
              "type": "string",
              "enum": [
                "quick",
                "medium",
                "deep"
              ]
            },
            "why": {
              "type": "string",
              "minLength": 1
            },
            "evidence": {
              "type": "array",
              "items": {
                "type": "object",
                "properties": {
                  "source": {
                    "type": "string",
                    "minLength": 1
                  },
                  "id": {
                    "type": "string",
                    "minLength": 1
                  },
                  "reason": {
                    "type": "string",
                    "minLength": 1
                  }
                },
                "required": [
                  "source",
                  "id",
                  "reason"
                ],
                "additionalProperties": false
              }
            }
          },
          "required": [
            "id",
            "title",
            "due",
            "timingReason",
            "effort",
            "why",
            "evidence"
          ],
          "additionalProperties": false
        },
        {
          "type": "null"
        }
      ]
    },
    "changes": {
      "type": "array",
      "items": {
        "type": "object",
        "properties": {
          "kind": {
            "type": "string",
            "minLength": 1
          },
          "title": {
            "type": "string",
            "minLength": 1
          },
          "summary": {
            "type": "string",
            "minLength": 1
          },
          "sourceId": {
            "type": "string",
            "minLength": 1
          },
          "impact": {
            "type": "string",
            "enum": [
              "quiet",
              "attention",
              "resolved"
            ]
          }
        },
        "required": [
          "kind",
          "title",
          "summary",
          "sourceId",
          "impact"
        ],
        "additionalProperties": false
      }
    },
    "connections": {
      "type": "array",
      "items": {
        "type": "object",
        "properties": {
          "id": {
            "type": "string",
            "minLength": 1
          },
          "title": {
            "type": "string",
            "minLength": 1
          },
          "reason": {
            "type": "string",
            "minLength": 1
          },
          "sourceIds": {
            "minItems": 2,
            "type": "array",
            "items": {
              "type": "string",
              "minLength": 1
            }
          },
          "evidence": {
            "minItems": 1,
            "type": "array",
            "items": {
              "type": "object",
              "properties": {
                "source": {
                  "type": "string",
                  "minLength": 1
                },
                "id": {
                  "type": "string",
                  "minLength": 1
                },
                "reason": {
                  "type": "string",
                  "minLength": 1
                }
              },
              "required": [
                "source",
                "id",
                "reason"
              ],
              "additionalProperties": false
            }
          }
        },
        "required": [
          "id",
          "title",
          "reason",
          "sourceIds",
          "evidence"
        ],
        "additionalProperties": false
      }
    },
    "anomalies": {
      "type": "array",
      "items": {
        "type": "object",
        "properties": {
          "id": {
            "type": "string",
            "minLength": 1
          },
          "title": {
            "type": "string",
            "minLength": 1
          },
          "summary": {
            "type": "string",
            "minLength": 1
          },
          "severity": {
            "type": "string",
            "enum": [
              "notice",
              "warning"
            ]
          },
          "evidence": {
            "minItems": 1,
            "type": "array",
            "items": {
              "type": "object",
              "properties": {
                "source": {
                  "type": "string",
                  "minLength": 1
                },
                "id": {
                  "type": "string",
                  "minLength": 1
                },
                "reason": {
                  "type": "string",
                  "minLength": 1
                }
              },
              "required": [
                "source",
                "id",
                "reason"
              ],
              "additionalProperties": false
            }
          }
        },
        "required": [
          "id",
          "title",
          "summary",
          "severity",
          "evidence"
        ],
        "additionalProperties": false
      }
    },
    "uncertainty": {
      "type": "array",
      "items": {
        "type": "object",
        "properties": {
          "source": {
            "type": "string",
            "minLength": 1
          },
          "reason": {
            "type": "string",
            "minLength": 1
          },
          "stale": {
            "type": "boolean"
          }
        },
        "required": [
          "source",
          "reason",
          "stale"
        ],
        "additionalProperties": false
      }
    },
    "rings": {
      "minItems": 3,
      "maxItems": 3,
      "type": "array",
      "items": {
        "type": "object",
        "properties": {
          "id": {
            "type": "string",
            "enum": [
              "today",
              "world",
              "setup"
            ]
          },
          "label": {
            "type": "string",
            "minLength": 1
          },
          "nodes": {
            "type": "array",
            "items": {
              "type": "object",
              "properties": {
                "id": {
                  "type": "string",
                  "minLength": 1
                },
                "label": {
                  "type": "string",
                  "minLength": 1
                },
                "status": {
                  "type": "string",
                  "enum": [
                    "clear",
                    "attention",
                    "stale"
                  ]
                },
                "count": {
                  "type": "integer",
                  "minimum": 0,
                  "maximum": 9007199254740991
                },
                "summary": {
                  "type": "string",
                  "minLength": 1
                },
                "evidence": {
                  "type": "array",
                  "items": {
                    "type": "object",
                    "properties": {
                      "source": {
                        "type": "string",
                        "minLength": 1
                      },
                      "id": {
                        "type": "string",
                        "minLength": 1
                      },
                      "reason": {
                        "type": "string",
                        "minLength": 1
                      }
                    },
                    "required": [
                      "source",
                      "id",
                      "reason"
                    ],
                    "additionalProperties": false
                  }
                }
              },
              "required": [
                "id",
                "label",
                "status",
                "count",
                "summary",
                "evidence"
              ],
              "additionalProperties": false
            }
          }
        },
        "required": [
          "id",
          "label",
          "nodes"
        ],
        "additionalProperties": false
      }
    },
    "personalizationSummary": {
      "type": "object",
      "properties": {
        "active": {
          "type": "boolean"
        },
        "summary": {
          "type": "string",
          "minLength": 1
        },
        "appliedPreferences": {
          "type": "array",
          "items": {
            "type": "string",
            "minLength": 1
          }
        }
      },
      "required": [
        "active",
        "summary",
        "appliedPreferences"
      ],
      "additionalProperties": false
    }
  },
  "required": [
    "version",
    "generatedAt",
    "fallbackMode",
    "sourceFreshness",
    "focus",
    "quickWin",
    "continueItem",
    "changes",
    "connections",
    "anomalies",
    "uncertainty",
    "rings",
    "personalizationSummary"
  ],
  "additionalProperties": false
}
